title,price,link,in stock,ratings
"The Coming Woman: A Novel Based on the Life of the Infamous Feminist, Victoria Woodhull",£17.93,http://books.toscrape.com/catalogue/../../../the-coming-woman-a-novel-based-on-the-life-of-the-infamous-feminist-victoria-woodhull_993/index.html,In stock,Three
The Boys in the Boat: Nine Americans and Their Epic Quest for Gold at the 1936 Berlin Olympics,£22.60,http://books.toscrape.com/catalogue/../../../the-boys-in-the-boat-nine-americans-and-their-epic-quest-for-gold-at-the-1936-berlin-olympics_992/index.html,In stock,Four
"Starving Hearts (Triangular Trade Trilogy, #1)",£13.99,http://books.toscrape.com/catalogue/../../../starving-hearts-triangular-trade-trilogy-1_990/index.html,In stock,Two
America's Cradle of Quarterbacks: Western Pennsylvania's Football Factory from Johnny Unitas to Joe Montana,£22.50,http://books.toscrape.com/catalogue/../../../americas-cradle-of-quarterbacks-western-pennsylvanias-football-factory-from-johnny-unitas-to-joe-montana_974/index.html,In stock,Three
Aladdin and His Wonderful Lamp,£53.13,http://books.toscrape.com/catalogue/../../../aladdin-and-his-wonderful-lamp_973/index.html,In stock,Three
Penny Maybe,£33.29,http://books.toscrape.com/catalogue/../../../penny-maybe_965/index.html,In stock,Three
Maude (1883-1993):She Grew Up with the country,£18.02,http://books.toscrape.com/catalogue/../../../maude-1883-1993she-grew-up-with-the-country_964/index.html,In stock,Two
"The Inefficiency Assassin: Time Management Tactics for Working Smarter, Not Longer",£20.59,http://books.toscrape.com/catalogue/../../../the-inefficiency-assassin-time-management-tactics-for-working-smarter-not-longer_935/index.html,In stock,Five
Soul Reader,£39.58,http://books.toscrape.com/catalogue/../../../soul-reader_926/index.html,In stock,Two
Bossypants,£49.46,http://books.toscrape.com/catalogue/../../../bossypants_883/index.html,In stock,Two
A World of Flavor: Your Gluten Free Passport,£42.95,http://books.toscrape.com/catalogue/../../../a-world-of-flavor-your-gluten-free-passport_879/index.html,In stock,One
"A Piece of Sky, a Grain of Rice: A Memoir in Four Meditations",£56.76,http://books.toscrape.com/catalogue/../../../a-piece-of-sky-a-grain-of-rice-a-memoir-in-four-meditations_878/index.html,In stock,Five
Tracing Numbers on a Train,£41.60,http://books.toscrape.com/catalogue/../../../tracing-numbers-on-a-train_869/index.html,In stock,Three
Thirteen Reasons Why,£52.72,http://books.toscrape.com/catalogue/../../../thirteen-reasons-why_866/index.html,In stock,One
The Secret (The Secret #1),£27.37,http://books.toscrape.com/catalogue/../../../the-secret-the-secret-1_859/index.html,In stock,Four
The Psychopath Test: A Journey Through the Madness Industry,£36.00,http://books.toscrape.com/catalogue/../../../the-psychopath-test-a-journey-through-the-madness-industry_857/index.html,In stock,Two
The Kite Runner,£41.82,http://books.toscrape.com/catalogue/../../../the-kite-runner_847/index.html,In stock,Four
The Girl on the Train,£55.02,http://books.toscrape.com/catalogue/../../../the-girl-on-the-train_844/index.html,In stock,Two
The Emerald Mystery,£23.15,http://books.toscrape.com/catalogue/../../../the-emerald-mystery_842/index.html,In stock,Two
The Bridge to Consciousness: I'm Writing the Bridge Between Science and Our Old and New Beliefs.,£32.00,http://books.toscrape.com/catalogue/../../../the-bridge-to-consciousness-im-writing-the-bridge-between-science-and-our-old-and-new-beliefs_840/index.html,In stock,Three
The Art of War,£33.34,http://books.toscrape.com/catalogue/../../../the-art-of-war_838/index.html,In stock,Five
Secrets and Lace (Fatal Hearts #1),£20.27,http://books.toscrape.com/catalogue/../../../secrets-and-lace-fatal-hearts-1_829/index.html,In stock,One
Romero and Juliet: A Tragic Tale of Love and Zombies,£36.94,http://books.toscrape.com/catalogue/../../../romero-and-juliet-a-tragic-tale-of-love-and-zombies_827/index.html,In stock,One
Poses for Artists Volume 1 - Dynamic and Sitting Poses: An Essential Reference for Figure Drawing and the Human Form,£41.06,http://books.toscrape.com/catalogue/../../../poses-for-artists-volume-1-dynamic-and-sitting-poses-an-essential-reference-for-figure-drawing-and-the-human-form_825/index.html,In stock,One
Miss Peregrine’s Home for Peculiar Children (Miss Peregrine’s Peculiar Children #1),£10.76,http://books.toscrape.com/catalogue/../../../miss-peregrines-home-for-peculiar-children-miss-peregrines-peculiar-children-1_819/index.html,In stock,One
Large Print Heart of the Pride,£19.15,http://books.toscrape.com/catalogue/../../../large-print-heart-of-the-pride_815/index.html,In stock,Two
Grumbles,£22.16,http://books.toscrape.com/catalogue/../../../grumbles_812/index.html,In stock,Two
First Steps for New Christians (Print Edition),£29.00,http://books.toscrape.com/catalogue/../../../first-steps-for-new-christians-print-edition_808/index.html,In stock,One
Eureka Trivia 6.0,£54.59,http://books.toscrape.com/catalogue/../../../eureka-trivia-60_805/index.html,In stock,Four
Drive: The Surprising Truth About What Motivates Us,£34.95,http://books.toscrape.com/catalogue/../../../drive-the-surprising-truth-about-what-motivates-us_804/index.html,In stock,Four
Done Rubbed Out (Reightman & Bailey #1),£37.72,http://books.toscrape.com/catalogue/../../../done-rubbed-out-reightman-bailey-1_803/index.html,In stock,Five
Beauty Restored (Riley Family Legacy Novellas #3),£11.11,http://books.toscrape.com/catalogue/../../../beauty-restored-riley-family-legacy-novellas-3_794/index.html,In stock,Two
Ayumi's Violin,£15.48,http://books.toscrape.com/catalogue/../../../ayumis-violin_791/index.html,In stock,Two
Anonymous,£46.82,http://books.toscrape.com/catalogue/../../../anonymous_790/index.html,In stock,Four
Amy Meets the Saints and Sages,£18.46,http://books.toscrape.com/catalogue/../../../amy-meets-the-saints-and-sages_789/index.html,In stock,Three
Amatus,£50.54,http://books.toscrape.com/catalogue/../../../amatus_787/index.html,In stock,Five
V for Vendetta (V for Vendetta Complete),£37.10,http://books.toscrape.com/catalogue/../../../v-for-vendetta-v-for-vendetta-complete_776/index.html,In stock,Four
"Unbroken: A World War II Story of Survival, Resilience, and Redemption",£45.95,http://books.toscrape.com/catalogue/../../../unbroken-a-world-war-ii-story-of-survival-resilience-and-redemption_774/index.html,In stock,Two
The Wright Brothers,£56.80,http://books.toscrape.com/catalogue/../../../the-wright-brothers_769/index.html,In stock,Four
The Songs of the Gods,£44.48,http://books.toscrape.com/catalogue/../../../the-songs-of-the-gods_763/index.html,In stock,Five
The Rosie Project (Don Tillman #1),£54.04,http://books.toscrape.com/catalogue/../../../the-rosie-project-don-tillman-1_761/index.html,In stock,One
The Power of Habit: Why We Do What We Do in Life and Business,£16.88,http://books.toscrape.com/catalogue/../../../the-power-of-habit-why-we-do-what-we-do-in-life-and-business_760/index.html,In stock,Three
Steve Jobs,£39.50,http://books.toscrape.com/catalogue/../../../steve-jobs_737/index.html,In stock,Five
Luckiest Girl Alive,£49.83,http://books.toscrape.com/catalogue/../../../luckiest-girl-alive_713/index.html,In stock,Three
"Living Leadership by Insight: A Good Leader Achieves, a Great Leader Builds Monuments",£46.91,http://books.toscrape.com/catalogue/../../../living-leadership-by-insight-a-good-leader-achieves-a-great-leader-builds-monuments_709/index.html,In stock,Four
Lady Midnight (The Dark Artifices #1),£16.28,http://books.toscrape.com/catalogue/../../../lady-midnight-the-dark-artifices-1_707/index.html,In stock,Five
"Hush, Hush (Hush, Hush #1)",£47.02,http://books.toscrape.com/catalogue/../../../hush-hush-hush-hush-1_701/index.html,In stock,Three
Greek Mythic History,£10.23,http://books.toscrape.com/catalogue/../../../greek-mythic-history_698/index.html,In stock,Five
Every Last Word,£46.47,http://books.toscrape.com/catalogue/../../../every-last-word_693/index.html,In stock,Three
Daily Fantasy Sports,£36.58,http://books.toscrape.com/catalogue/../../../daily-fantasy-sports_683/index.html,In stock,One
Clockwork Angel (The Infernal Devices #1),£44.14,http://books.toscrape.com/catalogue/../../../clockwork-angel-the-infernal-devices-1_679/index.html,In stock,One
City of Fallen Angels (The Mortal Instruments #4),£11.23,http://books.toscrape.com/catalogue/../../../city-of-fallen-angels-the-mortal-instruments-4_677/index.html,In stock,Four
City of Bones (The Mortal Instruments #1),£43.28,http://books.toscrape.com/catalogue/../../../city-of-bones-the-mortal-instruments-1_676/index.html,In stock,One
City of Ashes (The Mortal Instruments #2),£47.27,http://books.toscrape.com/catalogue/../../../city-of-ashes-the-mortal-instruments-2_675/index.html,In stock,One
"Carry On, Warrior: Thoughts on Life Unarmed",£31.85,http://books.toscrape.com/catalogue/../../../carry-on-warrior-thoughts-on-life-unarmed_672/index.html,In stock,Three
Carrie,£46.23,http://books.toscrape.com/catalogue/../../../carrie_671/index.html,In stock,Two
Angels & Demons (Robert Langdon #1),£51.48,http://books.toscrape.com/catalogue/../../../angels-demons-robert-langdon-1_661/index.html,In stock,Three
"The Three Searches, Meaning, and the Story",£13.33,http://books.toscrape.com/catalogue/../../../the-three-searches-meaning-and-the-story_649/index.html,In stock,Three
Raspberry Pi Electronics Projects for the Evil Genius,£49.67,http://books.toscrape.com/catalogue/../../../raspberry-pi-electronics-projects-for-the-evil-genius_630/index.html,In stock,Four
How to Speak Golf: An Illustrated Guide to Links Lingo,£58.32,http://books.toscrape.com/catalogue/../../../how-to-speak-golf-an-illustrated-guide-to-links-lingo_621/index.html,In stock,Five
Eleanor & Park,£56.51,http://books.toscrape.com/catalogue/../../../eleanor-park_616/index.html,In stock,Five
Troublemaker: Surviving Hollywood and Scientology,£48.39,http://books.toscrape.com/catalogue/../../../troublemaker-surviving-hollywood-and-scientology_610/index.html,In stock,Two
Adultery,£20.88,http://books.toscrape.com/catalogue/../../../adultery_586/index.html,In stock,Five
Unlimited Intuition Now,£58.87,http://books.toscrape.com/catalogue/../../../unlimited-intuition-now_578/index.html,In stock,Four
Underlying Notes,£11.82,http://books.toscrape.com/catalogue/../../../underlying-notes_577/index.html,In stock,Two
The New Brand You: Your New Image Makes the Sale for You,£44.05,http://books.toscrape.com/catalogue/../../../the-new-brand-you-your-new-image-makes-the-sale-for-you_575/index.html,In stock,Five
The Flowers Lied,£16.68,http://books.toscrape.com/catalogue/../../../the-flowers-lied_573/index.html,In stock,Two
"NaNo What Now? Finding your editing process, revising your NaNoWriMo book and building a writing career through publishing and beyond",£10.41,http://books.toscrape.com/catalogue/../../../nano-what-now-finding-your-editing-process-revising-your-nanowrimo-book-and-building-a-writing-career-through-publishing-and-beyond_566/index.html,In stock,Four
Modern Day Fables,£47.44,http://books.toscrape.com/catalogue/../../../modern-day-fables_565/index.html,In stock,Two
The Unlikely Pilgrimage of Harold Fry (Harold Fry #1),£43.62,http://books.toscrape.com/catalogue/../../../the-unlikely-pilgrimage-of-harold-fry-harold-fry-1_551/index.html,In stock,Five
The Martian (The Martian #1),£41.39,http://books.toscrape.com/catalogue/../../../the-martian-the-martian-1_548/index.html,In stock,Two
Left Behind (Left Behind #1),£40.72,http://books.toscrape.com/catalogue/../../../left-behind-left-behind-1_529/index.html,In stock,Two
John Vassos: Industrial Design for Modern Life,£20.22,http://books.toscrape.com/catalogue/../../../john-vassos-industrial-design-for-modern-life_526/index.html,In stock,Four
I'll Give You the Sun,£56.48,http://books.toscrape.com/catalogue/../../../ill-give-you-the-sun_525/index.html,In stock,One
Heaven is for Real: A Little Boy's Astounding Story of His Trip to Heaven and Back,£52.86,http://books.toscrape.com/catalogue/../../../heaven-is-for-real-a-little-boys-astounding-story-of-his-trip-to-heaven-and-back_520/index.html,In stock,Two
Ender's Game (The Ender Quintet #1),£43.64,http://books.toscrape.com/catalogue/../../../enders-game-the-ender-quintet-1_518/index.html,In stock,One
Death by Leisure: A Cautionary Tale,£37.51,http://books.toscrape.com/catalogue/../../../death-by-leisure-a-cautionary-tale_516/index.html,In stock,Four
Wildlife of New York: A Five-Borough Coloring Book,£22.14,http://books.toscrape.com/catalogue/../../../wildlife-of-new-york-a-five-borough-coloring-book_507/index.html,In stock,Two
The Year of Living Biblically: One Man's Humble Quest to Follow the Bible as Literally as Possible,£34.72,http://books.toscrape.com/catalogue/../../../the-year-of-living-biblically-one-mans-humble-quest-to-follow-the-bible-as-literally-as-possible_502/index.html,In stock,One
The Great Gatsby,£36.05,http://books.toscrape.com/catalogue/../../../the-great-gatsby_498/index.html,In stock,Four
The Good Girl,£49.03,http://books.toscrape.com/catalogue/../../../the-good-girl_497/index.html,In stock,Three
The 7 Habits of Highly Effective People: Powerful Lessons in Personal Change,£33.17,http://books.toscrape.com/catalogue/../../../the-7-habits-of-highly-effective-people-powerful-lessons-in-personal-change_489/index.html,In stock,Four
Steal Like an Artist: 10 Things Nobody Told You About Being Creative,£20.90,http://books.toscrape.com/catalogue/../../../steal-like-an-artist-10-things-nobody-told-you-about-being-creative_487/index.html,In stock,Two
Life of Pi,£13.22,http://books.toscrape.com/catalogue/../../../life-of-pi_475/index.html,In stock,Four
The Sound Of Love,£57.84,http://books.toscrape.com/catalogue/../../../the-sound-of-love_455/index.html,In stock,Five
The Perks of Being a Wallflower,£55.02,http://books.toscrape.com/catalogue/../../../the-perks-of-being-a-wallflower_453/index.html,In stock,Three
The Makings of a Fatherless Child,£31.58,http://books.toscrape.com/catalogue/../../../the-makings-of-a-fatherless-child_450/index.html,In stock,Two
The Hobbit (Middle-Earth Universe),£17.80,http://books.toscrape.com/catalogue/../../../the-hobbit-middle-earth-universe_447/index.html,In stock,Five
The Fellowship of the Ring (The Lord of the Rings #1),£10.27,http://books.toscrape.com/catalogue/../../../the-fellowship-of-the-ring-the-lord-of-the-rings-1_442/index.html,In stock,Two
Ship Leaves Harbor: Essays on Travel by a Recovering Journeyman,£30.60,http://books.toscrape.com/catalogue/../../../ship-leaves-harbor-essays-on-travel-by-a-recovering-journeyman_438/index.html,In stock,Three
Musicophilia: Tales of Music and the Brain,£46.58,http://books.toscrape.com/catalogue/../../../musicophilia-tales-of-music-and-the-brain_436/index.html,In stock,One
What If?: Serious Scientific Answers to Absurd Hypothetical Questions,£53.68,http://books.toscrape.com/catalogue/../../../what-if-serious-scientific-answers-to-absurd-hypothetical-questions_416/index.html,In stock,Four
The Fault in Our Stars,£47.22,http://books.toscrape.com/catalogue/../../../the-fault-in-our-stars_403/index.html,In stock,One
The Dream Thieves (The Raven Cycle #2),£34.50,http://books.toscrape.com/catalogue/../../../the-dream-thieves-the-raven-cycle-2_400/index.html,In stock,One
The 5th Wave (The 5th Wave #1),£11.83,http://books.toscrape.com/catalogue/../../../the-5th-wave-the-5th-wave-1_397/index.html,In stock,Two
Shiver (The Wolves of Mercy Falls #1),£16.23,http://books.toscrape.com/catalogue/../../../shiver-the-wolves-of-mercy-falls-1_392/index.html,In stock,Five
Remember Me?,£11.48,http://books.toscrape.com/catalogue/../../../remember-me_391/index.html,In stock,Three
If I Stay (If I Stay #1),£38.13,http://books.toscrape.com/catalogue/../../../if-i-stay-if-i-stay-1_379/index.html,In stock,Five
I Know Why the Caged Bird Sings (Maya Angelou's Autobiography #1),£36.55,http://books.toscrape.com/catalogue/../../../i-know-why-the-caged-bird-sings-maya-angelous-autobiography-1_378/index.html,In stock,Two
Harry Potter and the Deathly Hallows (Harry Potter #7),£23.32,http://books.toscrape.com/catalogue/../../../harry-potter-and-the-deathly-hallows-harry-potter-7_377/index.html,In stock,One
Fool Me Once,£16.96,http://books.toscrape.com/catalogue/../../../fool-me-once_374/index.html,In stock,One
Drama,£38.70,http://books.toscrape.com/catalogue/../../../drama_371/index.html,In stock,Two
"Blue Lily, Lily Blue (The Raven Cycle #3)",£34.13,http://books.toscrape.com/catalogue/../../../blue-lily-lily-blue-the-raven-cycle-3_364/index.html,In stock,Five
Alight (The Generations Trilogy #2),£58.59,http://books.toscrape.com/catalogue/../../../alight-the-generations-trilogy-2_360/index.html,In stock,Four
Vogue Colors A to Z: A Fashion Coloring Book,£52.35,http://books.toscrape.com/catalogue/../../../vogue-colors-a-to-z-a-fashion-coloring-book_355/index.html,In stock,Four
The Shining (The Shining #1),£27.88,http://books.toscrape.com/catalogue/../../../the-shining-the-shining-1_354/index.html,In stock,Three
The Hunger Games (The Hunger Games #1),£29.85,http://books.toscrape.com/catalogue/../../../the-hunger-games-the-hunger-games-1_349/index.html,In stock,Five
Outlander (Outlander #1),£19.67,http://books.toscrape.com/catalogue/../../../outlander-outlander-1_338/index.html,In stock,Five
Mockingjay (The Hunger Games #3),£20.44,http://books.toscrape.com/catalogue/../../../mockingjay-the-hunger-games-3_333/index.html,In stock,Four
Harry Potter and the Sorcerer's Stone (Harry Potter #1),£13.90,http://books.toscrape.com/catalogue/../../../harry-potter-and-the-sorcerers-stone-harry-potter-1_329/index.html,In stock,Three
Confessions of a Shopaholic (Shopaholic #1),£48.94,http://books.toscrape.com/catalogue/../../../confessions-of-a-shopaholic-shopaholic-1_318/index.html,In stock,Two
Zero History (Blue Ant #3),£34.77,http://books.toscrape.com/catalogue/../../../zero-history-blue-ant-3_308/index.html,In stock,One
World War Z: An Oral History of the Zombie War,£21.80,http://books.toscrape.com/catalogue/../../../world-war-z-an-oral-history-of-the-zombie-war_306/index.html,In stock,One
Wild: From Lost to Found on the Pacific Crest Trail,£46.02,http://books.toscrape.com/catalogue/../../../wild-from-lost-to-found-on-the-pacific-crest-trail_305/index.html,In stock,Three
"Where'd You Go, Bernadette",£18.13,http://books.toscrape.com/catalogue/../../../whered-you-go-bernadette_304/index.html,In stock,One
Twilight (Twilight #1),£41.93,http://books.toscrape.com/catalogue/../../../twilight-twilight-1_293/index.html,In stock,Two
The Paris Wife,£36.80,http://books.toscrape.com/catalogue/../../../the-paris-wife_269/index.html,In stock,Three
The Maze Runner (The Maze Runner #1),£20.93,http://books.toscrape.com/catalogue/../../../the-maze-runner-the-maze-runner-1_263/index.html,In stock,One
The Lover's Dictionary,£58.09,http://books.toscrape.com/catalogue/../../../the-lovers-dictionary_262/index.html,In stock,Two
The Goldfinch,£43.58,http://books.toscrape.com/catalogue/../../../the-goldfinch_252/index.html,In stock,Three
The Giver (The Giver Quartet #1),£12.30,http://books.toscrape.com/catalogue/../../../the-giver-the-giver-quartet-1_251/index.html,In stock,One
The Girl Who Played with Fire (Millennium Trilogy #2),£22.14,http://books.toscrape.com/catalogue/../../../the-girl-who-played-with-fire-millennium-trilogy-2_249/index.html,In stock,Two
The Demon-Haunted World: Science as a Candle in the Dark,£52.25,http://books.toscrape.com/catalogue/../../../the-demon-haunted-world-science-as-a-candle-in-the-dark_242/index.html,In stock,Four
The Book Thief,£53.49,http://books.toscrape.com/catalogue/../../../the-book-thief_233/index.html,In stock,Two
The Autobiography of Malcolm X,£23.43,http://books.toscrape.com/catalogue/../../../the-autobiography-of-malcolm-x_230/index.html,In stock,Two
Shopaholic & Baby (Shopaholic #5),£46.45,http://books.toscrape.com/catalogue/../../../shopaholic-baby-shopaholic-5_221/index.html,In stock,Two
Quiet: The Power of Introverts in a World That Can't Stop Talking,£43.55,http://books.toscrape.com/catalogue/../../../quiet-the-power-of-introverts-in-a-world-that-cant-stop-talking_208/index.html,In stock,One
Packing for Mars: The Curious Science of Life in the Void,£56.68,http://books.toscrape.com/catalogue/../../../packing-for-mars-the-curious-science-of-life-in-the-void_205/index.html,In stock,Two
Orange Is the New Black,£24.61,http://books.toscrape.com/catalogue/../../../orange-is-the-new-black_202/index.html,In stock,Two
One for the Money (Stephanie Plum #1),£32.87,http://books.toscrape.com/catalogue/../../../one-for-the-money-stephanie-plum-1_201/index.html,In stock,Two
Morning Star (Red Rising #3),£29.40,http://books.toscrape.com/catalogue/../../../morning-star-red-rising-3_196/index.html,In stock,One
Life After Life,£26.13,http://books.toscrape.com/catalogue/../../../life-after-life_187/index.html,In stock,Two
"Lean In: Women, Work, and the Will to Lead",£25.02,http://books.toscrape.com/catalogue/../../../lean-in-women-work-and-the-will-to-lead_183/index.html,In stock,One
Is Everyone Hanging Out Without Me? (And Other Concerns),£20.11,http://books.toscrape.com/catalogue/../../../is-everyone-hanging-out-without-me-and-other-concerns_178/index.html,In stock,Three
Gone Girl,£37.60,http://books.toscrape.com/catalogue/../../../gone-girl_162/index.html,In stock,Five
Fellside,£38.62,http://books.toscrape.com/catalogue/../../../fellside_155/index.html,In stock,One
Eclipse (Twilight #3),£18.74,http://books.toscrape.com/catalogue/../../../eclipse-twilight-3_152/index.html,In stock,One
Dracula,£52.62,http://books.toscrape.com/catalogue/../../../dracula_150/index.html,In stock,Three
Dead Wake: The Last Crossing of the Lusitania,£39.24,http://books.toscrape.com/catalogue/../../../dead-wake-the-last-crossing-of-the-lusitania_147/index.html,In stock,Five
"David and Goliath: Underdogs, Misfits, and the Art of Battling Giants",£17.81,http://books.toscrape.com/catalogue/../../../david-and-goliath-underdogs-misfits-and-the-art-of-battling-giants_146/index.html,In stock,One
