title,price,link,in stock,ratings
Online Marketing for Busy Authors: A Step-By-Step Guide,£46.35,http://books.toscrape.com/catalogue/../../../online-marketing-for-busy-authors-a-step-by-step-guide_913/index.html,In stock,One
How to Be Miserable: 40 Strategies You Already Use,£46.03,http://books.toscrape.com/catalogue/../../../how-to-be-miserable-40-strategies-you-already-use_897/index.html,In stock,One
"Overload: How to Unplug, Unwind, and Unleash Yourself from the Pressure of Stress",£52.15,http://books.toscrape.com/catalogue/../../../overload-how-to-unplug-unwind-and-unleash-yourself-from-the-pressure-of-stress_725/index.html,In stock,Three
You Are a Badass: How to Stop Doubting Your Greatness and Start Living an Awesome Life,£12.08,http://books.toscrape.com/catalogue/../../../you-are-a-badass-how-to-stop-doubting-your-greatness-and-start-living-an-awesome-life_508/index.html,In stock,Three
How to Stop Worrying and Start Living,£46.49,http://books.toscrape.com/catalogue/../../../how-to-stop-worrying-and-start-living_431/index.html,In stock,Five
